{
  "schema_version": "2.6.7",
  "package_id": "battery_snl_lfp_source_entry_binding_review_v1",
  "case_study_id": "battery_archive_snl_lfp",
  "bounded_source_id": "snl_lfp_commercial_18650_study",
  "source_entry_binding_manifest_path": "data/platform/battery_snl_lfp_source_entry_binding_manifest_v1.json",
  "v2_6_5_source_evidence_summary_path": "data/processed/battery_v2_6_5_snl_lfp_source_evidence_summary.json",
  "v2_6_6_artifact_binding_summary_path": "data/processed/battery_v2_6_6_snl_lfp_artifact_binding_summary.json",
  "expected_v2_6_5_checksum": "b6e0c950f11cb1edfbd3afdd15776af25c76b092d130d6038b6653ecd63ba846",
  "expected_v2_6_6_checksum": "f4c02c38652848ddba6a69ffe47010e0cb7ada3ad411fd028afdd5ff552b89e5",
  "required_evidence_fields": [
    "chemistry",
    "nominal_capacity",
    "ambient_temperature",
    "charge_protocol",
    "discharge_protocol",
    "cutoff_voltage",
    "measurement_calibration",
    "source_snapshot"
  ],
  "required_binding_dimensions": [
    "publication_to_repository",
    "repository_filename_nomenclature",
    "study_to_condition_group",
    "condition_group_to_entry_pattern",
    "physical_cell_to_entry",
    "cycle_command_to_rows",
    "instrument_channel_to_columns",
    "official_distribution_snapshot"
  ],
  "read_policy": {
    "allow_tracked_json_reads": true,
    "allow_raw_archive_read": false,
    "allow_entry_payload_read": false,
    "allow_csv_header_read": false,
    "allow_csv_row_read": false,
    "allow_archive_extraction": false
  },
  "credential_policy": {
    "store_credentials": false,
    "network_access_required": false
  },
  "output_root": "outputs/v2_6_battery_snl_lfp_source_entry_binding",
  "tracked_summary_path": "data/processed/battery_v2_6_7_snl_lfp_source_entry_binding_summary.json",
  "output_policy": "tracked_compact_summary_and_local_full_result",
  "dry_run": true
}
